Пельменная №2,https://www.tripadvisor.ru/Restaurant_Review-g298516-d6181689-Reviews-Pelmennaya_No_2-Perm_Perm_Krai_Volga_District.html,"Ленина, 47, Пермь 614000 Россия",Рестораны,,,3 отзыва,Вкусно! Чисто! Красиво!,"Очень хорошее место! Интерьер, чистота, сервис всё на отлично! Пельмени просто космос! Всем рекомендую посетить!!!",tag,50,Дата посещения: сентябрь 2021 г.,25 сентября 2021 г.,,ArkadiySuslov,https://www.tripadvisor.ru/Profile/ArkadiySuslov,0,0,3,0,1,(4),В сообществе с март 2013 г.,
Пельменная №2,https://www.tripadvisor.ru/Restaurant_Review-g298516-d6181689-Reviews-Pelmennaya_No_2-Perm_Perm_Krai_Volga_District.html,"Ленина, 47, Пермь 614000 Россия",Рестораны,,,64 отзыва,Вкусный обед в Перми,"Чудесное место, с северо-русским колоритом в обстановке и особенно в меню! Вкусные пельмени и салаты, посикунсики! Брали дигустационные наборы и того, и другого. Рекомендую!",tag,50,,12 июля 2021 г.,0,Milaya-milla,https://www.tripadvisor.ru/Profile/Milaya-milla,1,0,227,51,6,(188),"Москва, Россия",В сообществе с май 2012 г.
Пельменная №2,https://www.tripadvisor.ru/Restaurant_Review-g298516-d6181689-Reviews-Pelmennaya_No_2-Perm_Perm_Krai_Volga_District.html,"Ленина, 47, Пермь 614000 Россия",Рестораны,,,48 отзывов,Отличный ужин в пельменной,"Отличное обслуживание, не плохой интерьер, очень вкусные пельмени( есть даже несколько сетов дигустационных) оригинальный южный соус с кинзой, хорошая армянская водка гранатовая.",tag,50,Дата посещения: май 2021 г.,11 июня 2021 г.,,petr121222,https://www.tripadvisor.ru/Profile/petr121222,1,0,50,11,4,(21),"Самара, Россия",В сообществе с апр. 2016 г.
Пельменная №2,https://www.tripadvisor.ru/Restaurant_Review-g298516-d6181689-Reviews-Pelmennaya_No_2-Perm_Perm_Krai_Volga_District.html,"Ленина, 47, Пермь 614000 Россия",Рестораны,,,168 отзывов,Ужин,"В такси из аэропорта таксист поведал мне о большом разнообразии общепита в Перми. В том числе и о популярной пельменной номер 2. Посетил. Как и ранее, очень вкусно. Пельмени очень очень. Обстановка скромная.",tag,50,,30 мая 2021 г.,0,Yuri30061965,https://www.tripadvisor.ru/Profile/Yuri30061965,0,0,690,220,6,(57),"Москва, Россия",В сообществе с янв. 2019 г.
Пельменная №2,https://www.tripadvisor.ru/Restaurant_Review-g298516-d6181689-Reviews-Pelmennaya_No_2-Perm_Perm_Krai_Volga_District.html,"Ленина, 47, Пермь 614000 Россия",Рестораны,,,90 отзывов,"Локальная кухня, отличное","Локальная кухня, отличное обслуживание, приятная атмосфера, трушные посикунчики. Под еду дают водочку и в конце комплимент. Из минусов -находится в подвале, нет летней веранды.",tag,50,Дата посещения: май 2021 г.,14 мая 2021 г.,1  ,737dmitrys,https://www.tripadvisor.ru/Profile/737dmitrys,1,0,112,92,5,(46),"Москва, Россия",В сообществе с июнь 2014 г.
Пельменная №2,https://www.tripadvisor.ru/Restaurant_Review-g298516-d6181689-Reviews-Pelmennaya_No_2-Perm_Perm_Krai_Volga_District.html,"Ленина, 47, Пермь 614000 Россия",Рестораны,,,51 отзыв,Ресторан надежд не оправдал.,"Это скорее кафе с несколько претенциозным, но скучным интерьером и крайне долгим обслуживанием. Пельмени не пробовала, а вот посикунчики совсем не вкусные. Мы пробовали их за время визита в Пермь в разных местах, здесь оказались самые скучные.",tag,30,Дата посещения: март 2021 г.,23 апреля 2021 г.,2  ,422yaroslava,https://www.tripadvisor.ru/Profile/422yaroslava,0,0,136,63,5,(20),"Санкт-Петербург, Россия",В сообществе с окт. 2018 г.
Пельменная №2,https://www.tripadvisor.ru/Restaurant_Review-g298516-d6181689-Reviews-Pelmennaya_No_2-Perm_Perm_Krai_Volga_District.html,"Ленина, 47, Пермь 614000 Россия",Рестораны,,,5 отзывов,Супер,"Классное место, очень вкусно и уютно!!! Хорошее меню, очень большии порции. Спасибо большое Ксении за гостеприимство!",tag,50,Дата посещения: январь 2021 г.,27 января 2021 г.,,_W3669YO,https://www.tripadvisor.ru/Profile/_W3669YO,0,0,12,5,2,(3),"Москва, Россия",В сообществе с март 2014 г.
Пельменная №2,https://www.tripadvisor.ru/Restaurant_Review-g298516-d6181689-Reviews-Pelmennaya_No_2-Perm_Perm_Krai_Volga_District.html,"Ленина, 47, Пермь 614000 Россия",Рестораны,,,4 отзыва,Зашли пообедать семьей,"Зашли пообедать семьей, по случаю приезда в Пермь. Обслужили быстро, персонал дружелюбный! В пельменной уютно и тепло. Качество блюд на твёрдую 4. Брали мясные пельмени, пельмени с редькой , соленья.",tag,50,Дата посещения: январь 2021 г.,7 января 2021 г.,1  ,Explorer498414,https://www.tripadvisor.ru/Profile/Explorer498414,0,1,5,7,1,(33),"Екатеринбург, Россия",В сообществе с сент. 2013 г.
